{
  "schemaVersion": "3.0.0",
  "eventId": "evt_background_scope_01",
  "eventName": "lynx.background_runtime.started",
  "category": "runtime",
  "source": "background_runtime",
  "occurredAtUnixMs": 1760000600000,
  "monotonicOffsetMs": 100,
  "sequenceNo": 1,
  "navigationId": null,
  "navigationSessionId": null,
  "pageViewId": null,
  "entryId": null,
  "renderAttemptId": null,
  "activationId": null,
  "transactionId": null,
  "runtimeKind": "background_runtime",
  "runtimeInstanceId": "background_001",
  "runtimeGeneration": 1,
  "telemetryRouteKey": "background_runtime",
  "hostMode": "activity",
  "platform": "android",
  "hostApp": "lynx-demo",
  "appVersion": "1.0.0",
  "buildNumber": "100",
  "lynxSdkVersion": "4.0.0",
  "engineVersion": "4.0.0",
  "sampleRate": 0,
  "samplingGroup": "background_runtime",
  "samplingRuleVersion": "disabled_0",
  "inclusionProbability": 0,
  "analysisEligible": false,
  "samplingReason": "not_sampled",
  "deliveryOwner": "internal",
  "privacy": { "consentState": "granted", "subjectRefPresent": false, "optOut": false },
  "attributes": { "enabled": false, "dropReason": "background_runtime_out_of_scope" }
}
