{
  "schemaVersion": "3.0.0",
  "eventId": "evt_sampled_page_view_01",
  "eventName": "sampled_page_view",
  "category": "page",
  "source": "native",
  "occurredAtUnixMs": 1760000500000,
  "monotonicOffsetMs": 600,
  "sequenceNo": 6,
  "navigationId": "nav_006",
  "navigationSessionId": "nav_session_001",
  "pageViewId": "pv_006",
  "entryId": "entry_006",
  "renderAttemptId": "attempt_006",
  "activationId": "activation_006",
  "transactionId": null,
  "runtimeKind": "lynx_view",
  "runtimeInstanceId": "runtime_006",
  "telemetryRouteKey": "10000001/mall.lynx.bundle",
  "hostMode": "activity",
  "platform": "android",
  "hostApp": "lynx-demo",
  "appVersion": "1.0.0",
  "buildNumber": "100",
  "lynxSdkVersion": "4.0.0",
  "engineVersion": "4.0.0",
  "lifecycle": {
    "pageState": "visible",
    "appState": "foreground",
    "attemptState": "usable",
    "activeEligible": true
  },
  "sampleRate": 0.05,
  "samplingGroup": "mall_funnel",
  "samplingRuleVersion": "sampling_20260813_01",
  "inclusionProbability": 0.05,
  "analysisEligible": true,
  "samplingReason": "stable_cohort",
  "deliveryOwner": "external",
  "privacy": { "consentState": "granted", "subjectRefPresent": false, "optOut": false },
  "attributes": { "cohort": "mall_funnel", "denominator": "page_view" }
}
