{
  "schemaVersion": "3.0.0",
  "eventId": "evt_rollback_01",
  "eventName": "ota.rollback",
  "category": "ota",
  "source": "native",
  "occurredAtUnixMs": 1760000200000,
  "monotonicOffsetMs": 2100,
  "sequenceNo": 8,
  "navigationId": "nav_003",
  "navigationSessionId": "nav_session_001",
  "pageViewId": "pv_003",
  "entryId": "entry_003",
  "renderAttemptId": "attempt_003_retry",
  "activationId": null,
  "transactionId": "tx_003",
  "otaOperationId": "ota_rollback_001",
  "runtimeKind": "lynx_view",
  "runtimeInstanceId": "runtime_003",
  "runtimeGeneration": 2,
  "telemetryRouteKey": "10000001/checkout.lynx.bundle",
  "hostMode": "activity",
  "platform": "android",
  "hostApp": "lynx-demo",
  "appVersion": "1.0.0",
  "buildNumber": "100",
  "lynxSdkVersion": "4.0.0",
  "engineVersion": "4.0.0",
  "attemptedBundleSnapshot": {
    "kind": "attempted",
    "bundleSource": "ota",
    "lynxAppId": "10000001",
    "bundleName": "checkout.lynx.bundle",
    "telemetryRouteKey": "10000001/checkout.lynx.bundle",
    "otaOperationId": "ota_rollback_001",
    "candidateReleaseId": "release_bad_03",
    "expectedSha256": "cccccccccccccccccccccccccccccccccccccccccccccccccccccccccccccccc",
    "prepareStartedAtUnixMs": 1760000197000,
    "attemptGeneration": 1
  },
  "resolvedBundleSnapshot": {
    "kind": "resolved",
    "bundleSource": "ota",
    "lynxAppId": "10000001",
    "bundleName": "checkout.lynx.bundle",
    "telemetryRouteKey": "10000001/checkout.lynx.bundle",
    "releaseId": "release_good_02",
    "bundleSha256": "dddddddddddddddddddddddddddddddddddddddddddddddddddddddddddddddd",
    "engineVersion": "4.0.0",
    "localGeneration": "generation_04",
    "rollbackFromReleaseId": "release_bad_03",
    "resolvedAtUnixMs": 1760000199800
  },
  "lifecycle": {
    "pageState": "registered",
    "appState": "foreground",
    "attemptState": "usable",
    "activeEligible": false,
    "reason": "reload"
  },
  "navigationAdmission": { "state": "accepted" },
  "sampleRate": 1,
  "samplingGroup": "page_quality",
  "samplingRuleVersion": "sampling_20260813_01",
  "inclusionProbability": 1,
  "analysisEligible": true,
  "samplingReason": "forced_diagnostic",
  "deliveryOwner": "internal",
  "privacy": { "consentState": "granted", "subjectRefPresent": false, "optOut": false },
  "attributes": { "result": "rolledBack", "fromReleaseId": "release_bad_03", "toReleaseId": "release_good_02" }
}
