{
  "schemaVersion": "3.0.0",
  "eventId": "evt_page_first_screen_01",
  "eventName": "lynx.page.first_screen",
  "category": "page",
  "source": "native",
  "occurredAtUnixMs": 1760000000123,
  "monotonicOffsetMs": 842,
  "sequenceNo": 7,
  "navigationId": "nav_001",
  "navigationSessionId": "nav_session_001",
  "pageViewId": "pv_001",
  "entryId": "entry_001",
  "renderAttemptId": "attempt_001",
  "activationId": "activation_001",
  "transactionId": "tx_001",
  "runtimeKind": "lynx_view",
  "runtimeInstanceId": "runtime_001",
  "runtimeGeneration": 1,
  "telemetryRouteKey": "10000001/home.lynx.bundle",
  "hostMode": "activity",
  "platform": "android",
  "hostApp": "lynx-demo",
  "appVersion": "1.0.0",
  "buildNumber": "100",
  "lynxSdkVersion": "4.0.0",
  "engineVersion": "4.0.0",
  "resolvedBundleSnapshot": {
    "kind": "resolved",
    "bundleSource": "ota",
    "lynxAppId": "10000001",
    "bundleName": "home.lynx.bundle",
    "telemetryRouteKey": "10000001/home.lynx.bundle",
    "releaseId": "release_20260813_01",
    "bundleSha256": "aaaaaaaaaaaaaaaaaaaaaaaaaaaaaaaaaaaaaaaaaaaaaaaaaaaaaaaaaaaaaaaa",
    "engineVersion": "4.0.0",
    "localGeneration": "generation_03",
    "resolvedAtUnixMs": 1760000000000
  },
  "lifecycle": {
    "pageState": "visible",
    "appState": "foreground",
    "attemptState": "usable",
    "activeEligible": true
  },
  "navigationAdmission": { "state": "accepted" },
  "transition": { "state": "terminal", "terminal": "completed", "durationMs": 285 },
  "sampleRate": 1,
  "samplingGroup": "page_quality",
  "samplingRuleVersion": "sampling_20260813_01",
  "inclusionProbability": 1,
  "analysisEligible": true,
  "samplingReason": "stable_cohort",
  "deliveryOwner": "internal",
  "privacy": { "consentState": "granted", "subjectRefPresent": false, "optOut": false },
  "attributes": { "firstScreenSource": "lynx_callback" }
}
