{
  "schemaVersion": "3.0.0",
  "eventId": "evt_exposure_recovery_01",
  "eventName": "lynx.exposure.qualified",
  "category": "exposure",
  "source": "lynx_runtime",
  "occurredAtUnixMs": 1760000401000,
  "monotonicOffsetMs": 9200,
  "sequenceNo": 22,
  "navigationId": "nav_005",
  "navigationSessionId": "nav_session_001",
  "pageViewId": "pv_005",
  "entryId": "entry_005",
  "renderAttemptId": "attempt_005",
  "activationId": "activation_005_02",
  "transactionId": null,
  "runtimeKind": "lynx_view",
  "runtimeInstanceId": "runtime_005",
  "runtimeGeneration": 2,
  "telemetryRouteKey": "10000001/mall.lynx.bundle",
  "hostMode": "activity",
  "platform": "android",
  "hostApp": "lynx-demo",
  "appVersion": "1.0.0",
  "buildNumber": "100",
  "lynxSdkVersion": "4.0.0",
  "engineVersion": "4.0.0",
  "exposure": {
    "exposureKey": "mall.product_card",
    "contentId": "sku_1001",
    "exposureSessionId": "exposure_005_02",
    "position": 2,
    "occurrence": 2,
    "reportOnce": false,
    "visibleRatioThreshold": 0.5,
    "maxVisibleRatio": 0.93,
    "minDurationMs": 1000,
    "ruleVersion": "exposure_rule_01",
    "observerGeneration": 2
  },
  "lifecycle": {
    "pageState": "visible",
    "appState": "foreground",
    "attemptState": "usable",
    "activeEligible": true
  },
  "sampleRate": 0.05,
  "samplingGroup": "mall_funnel",
  "samplingRuleVersion": "sampling_20260813_01",
  "inclusionProbability": 0.05,
  "analysisEligible": true,
  "samplingReason": "stable_cohort",
  "deliveryOwner": "external",
  "privacy": { "consentState": "granted", "subjectRefPresent": false, "optOut": false },
  "attributes": { "resumeReason": "covered_return", "observerAction": "disconnect_recreate_reobserve" }
}
