{
  "schemaVersion": "3.0.0",
  "eventId": "evt_stale_callback_01",
  "eventName": "telemetry.stale_callback_dropped",
  "category": "telemetry",
  "source": "native",
  "occurredAtUnixMs": 1760000300000,
  "monotonicOffsetMs": 4000,
  "sequenceNo": 12,
  "navigationId": "nav_004",
  "navigationSessionId": "nav_session_001",
  "pageViewId": "pv_004",
  "entryId": "entry_004",
  "renderAttemptId": "attempt_004_new",
  "activationId": null,
  "transactionId": null,
  "runtimeKind": "lynx_view",
  "runtimeInstanceId": "runtime_004",
  "runtimeGeneration": 2,
  "telemetryRouteKey": "10000001/home.lynx.bundle",
  "hostMode": "activity",
  "platform": "android",
  "hostApp": "lynx-demo",
  "appVersion": "1.0.0",
  "buildNumber": "100",
  "lynxSdkVersion": "4.0.0",
  "engineVersion": "4.0.0",
  "sampleRate": 1,
  "samplingGroup": "page_quality",
  "samplingRuleVersion": "sampling_20260813_01",
  "inclusionProbability": 1,
  "analysisEligible": false,
  "samplingReason": "forced_diagnostic",
  "deliveryOwner": "internal",
  "privacy": { "consentState": "granted", "subjectRefPresent": false, "optOut": false },
  "attributes": { "callbackGeneration": 1, "activeGeneration": 2, "dropReason": "render_attempt_replaced" }
}
